{
  "id": "4c5d6e7f-8a9b-4c0d-1e2f-4a5b6c7d8e9f",
  "type": "fuel.reading",
  "source": "fleet-api",
  "time": "2025-01-15T08:35:00Z",
  "data": {
    "bus_id": "3f6b8f2e-7a1c-4d5b-9e0a-1b2c3d4e5f60",
    "ts": "2025-01-15T08:34:58Z",
    "h2_level_pct": 63.8,
    "consumption_kg_per_100km": 8.1,
    "estimated_range_km": 296.0,
    "energy_level_pct": 63.8,
    "energy_unit": "kg"
  }
}
